City,Accommodation,Apartment Name,Furnishing,Tenant Preferred,Availability,Carpet Area,Floor,Facing,overlooking,Bathroom,Balcony,Rent,Description
hyderabad,2 BHK Apartment for Rent in Nizampet,Bommarillu Homes,Semi-Furnished,Bachelors,From Jun '22,None,1 out of 5,West,None,2,2,"₹14,000","Semi furnished rooms with good interiors. Large 2 bed rooms , 2 balconys, Modular cupboards kitchen,Flat in ground floor, Car parking, under surveillance cctv all floors surveillance cameras,2 bed rooms cupboards , Master bedroom have space for beeruva in between cupboards,Water meter available for individual apartment semi furnished with wardrobes and modular kitchen , fans , lights and all the basic electrical fittings"
hyderabad,"3 BHK Apartment for Rent in Financial District, Nanakram Guda",None,Furnished,Family,From Jun '22,2200 sqft,6 out of 10,East,"Garden/Park, Pool, Main Road",5,2,"₹75,000","East facing, fully furnished flat with modular kitchen, power back up for Immediate sale. If taking a flat for rent is on you mind, you must go for 3 BHK flat in Financial District, Nanakram Guda located at the heart of the city. The Rent amount is set at an attractive price of Rs 75,000/-. Plus you need to pay a booking amount of only Rs 150000/-. We are particular about whom we let out the flat to and the type of tenants preferred are Family. Strategically located near the property close to near the metro station and schools temples.., the flat is smartly located to offer seamless connectivity. It provides an amazing view of garden/park, pool, main road. To park your car, the flat comes with a its own 1 covered car parking. Also, it features 2 balconies that are spacious. The flat on rent has 3 large and spacious bedrooms. With 1 store room attached, the extra articles can be easily stored. Also, it has 1 study room that can be used as a guest room or a home office. A beautifully designed abode, the flat is furnished. Owing to continuous demand, the flat is select date for rent. "
hyderabad,3 BHK Apartment for Rent in Garuda residency peacock,None,Semi-Furnished,Bachelors/Family,Immediately,1600 sqft,2 out of 5,None,None,3,3,"₹23,000","The rent amount of the flat is very competitive and set at an amount of Rs 23,000/-. We have some preferences about the tenants to rent the flat and the preferred tenants are Bachelors/Family. In addition to this, the flat is studded with capacious 3 balconies. The flat listed for rent boasts of 3 sizable and aesthetically designed bedrooms. Designed to meet your modern needs, the flat comes semi-furnished. Studded with almost all the features, the flat is immediately available for rent. "
hyderabad,3 BHK Apartment for Rent in Kompally,Delight Fortune,Semi-Furnished,Bachelors/Family,Immediately,None,1 out of 5,None,None,3,2,"₹24,000","Multistorey apartment is available for rent. It is a good location property. Please contact for more details. Rent flats of 3 BHK in the prime locality of Kompally. Located within the premium project of Delight Fortune, this well-ventilated flat is available on rent. The rental amount of the flat is an affordable Rs 24,000/-. Although, the occupier is required to deposit a booking amount of Rs 50000/-. We have some preferences about the tenants to rent the flat and the preferred tenants are Bachelors/Family. Also, it features 2 balconies that are spacious. This flat on rent comes with 3 well planned bedrooms. The flat is well-designed and comes semi-furnished, with a unique appeal. Studded with almost all the features, the flat is immediately available for rent. "
hyderabad,2 BHK Builder Floor for Rent in ECIL,None,Furnished,Bachelors/Family,Immediately,None,3 out of 6,None,None,2,None,"₹15,000","Rent flats of 2 BHK in the prime locality of ECIL. The Rent amount is set at an attractive price of Rs 15,000/-. We keep a say in the type of tenants preferred to rent our flat and the tenants preferred are Bachelors/Family. The flat listed for rent boasts of 2 sizable and aesthetically designed bedrooms. To serve the occupier optimally, the flat comes furnished. Studded with almost all the features, the flat is immediately available for rent. "
hyderabad,"2 BHK Apartment for Rent in JV Hills, Kondapur",None,Unfurnished,Bachelors,Immediately,1058 sqft,4 out of 5,None,Garden/Park,2,2,"₹20,000","This 2bhk semi furnished apartment is located right near the tech industry hub of hyderabad. The distance between this apartment to hitech city is only 4kms and similarly, the area in which the apartment is located connects to 2 different metro stations by only a distance of 3.4 km which are hitech city"
hyderabad,"3 BHK Apartment for Rent in Muppas Panchavati Colony, Manikonda, Outer Ring Road",None,Unfurnished,Family,Immediately,1180 sqft,5 out of 5,East,Main Road,2,3,"₹17,000","This 3 BHK Flat is at 5 floor and it has 2 bathroom You can avail this Flat on a monthly charges of 16000. Do you want to rent flat for accomodation? Consider 3 BHK flat in the popular locality of Muppas Panchavati Colony, Manikonda, Outer Ring Road. The rental rates are quite justifiable and set at an amount of Rs 17,000/-. However, you are required to deposit a booking amount of Rs 32000/-. We are selective about renting out the flat and the type of tenants preferred are Family. The flat is well-connected and positioned near near by panchavati park panchvati colony.. It is well-positioned and one can get a view of main road. The flat also has 3 balconies for a multiple usages. The flat offered on rent is equipped with 3 well-designed bedrooms. Designed to meet your modern needs, the flat comes unfurnished. It is immediately available for rent. "
hyderabad,"3 BHK Apartment for Rent in Gachibowli CUC, Outer Ring Road",Northstar District 1,Semi-Furnished,Bachelors/Family,Immediately,1560 sqft,Ground out of 13,East,Garden/Park,3,1,"₹50,000","Financial District, Hyderabad, Hyderabad3 bhk, master bedroom with wooden flooring, modular kitchen, 2 wide balconies, brand new semi furnished flat with excellent interiors very good ventilation, 1560sqft, east facing, ground floor, 2 car parkingAmenities1. Yoga and meditation space2. Basket ball3. Squash court4. Indoor play areaBilliards, tt5. Library business lounge6. Gym7. Swimming pool"
hyderabad,3 BHK Apartment for Rent in Nizampet,None,Semi-Furnished,Bachelors/Family,Immediately,1000 sqft,4,West,Main Road,2,1,"₹18,000","West facing 3BHK flat is available for rent with a good view, ample sunlight, 24 hours water, geyser in bath rooms, one air conditioner, convenient car parking, complete wood work, Manjeera water everyday. It is ready to occupy, split AC provision. Please contact for more details."
hyderabad,2 BHK Apartment for Rent in Balkampet,None,Unfurnished,Bachelors,Immediately,840 sqft,1 out of 3,South - East,"Garden/Park, Main Road",2,1,"₹13,500","Newly construction building for newly married couples Do you want to rent flat for accomodation? Consider 2 BHK flat in the popular locality of Balkampet. The rental amount of the flat is an affordable Rs 13,500/-. However, you will have to deposit a booking amount of Rs 24000/- if you wish to rent this flat. We have some choices in term of preferred tenants to let out the flat and the tenants preferred are Bachelors. The flat boasts of a superb location near goutham model high school. It provides an amazing view of garden/park, main road. It also has 1 balconies. The flat available on rent features 2 spacious bedrooms. The flat comes unfurnished and is sure to appeal to you. Owing to continuous demand, the flat is immediately available for rent. "
hyderabad,1 BHK Builder Floor for Rent in Jagadgiri Gutta,None,Unfurnished,Bachelors/Family,Immediately,None,3 out of 4,None,None,1,None,"₹4,500","If taking a flat for rent is on you mind, you must go for 1 BHK flat in Jagadgiri Gutta located at the heart of the city. The rental amount of the flat is an affordable Rs 4,500/-. We keep a say in the type of tenants preferred to rent our flat and the tenants preferred are Bachelors/Family. This flat on rent comes with 1 well planned bedrooms. A beautifully designed abode, the flat is unfurnished. It is immediately available for rent. "
hyderabad,2 BHK Apartment for Rent in Rayadurga Kalaasa,None,Semi-Furnished,Bachelors/Family,Immediately,None,2 out of 5,None,None,2,None,"₹15,000","The Rent amount is set at an attractive price of Rs 15,000/-. We have some preferences about the tenants to rent the flat and the preferred tenants are Bachelors/Family. The flat on rent has 2 large and spacious bedrooms. The flat comes semi-furnished and is sure to appeal to you. Studded with almost all the features, the flat is immediately available for rent. "
hyderabad,3 BHK Apartment for Rent in Moti Nagar,None,Unfurnished,Bachelors/Family,Immediately,None,3 out of 9,None,None,3,None,"₹13,500","Well designed and constructed Multistorey Apartment in the prime locality of Moti Nagar. The Multistorey Apartment having total 3rd floor with all modern facilities Lift, Security, Reserved Parking. Currently 3 BHK flat on 3rd floor is available for rent at very competitive price. Gymnasium, Swimming Pool, Club House, Park, Private Terrace/ Garden, Vaastu Compliant, Air Conditioned, Rain Water Harvesting, Water Storage, Intercom Facility"
hyderabad,2 BHK Apartment for Rent in Bachupally,None,Semi-Furnished,Bachelors/Family,From Jun '22,None,2 out of 5,None,None,2,None,"₹12,000","Multistorey apartment is available for rent. It is a good location property. Please contact for more detail. Rent flats of 2 BHK in the prime locality of Bachupally. The rent amount of the flat is very competitive and set at an amount of Rs 12,000/-. We have some preferences about the tenants to rent the flat and the preferred tenants are Bachelors/Family. The flat on rent has 2 large and spacious bedrooms. To serve the occupier optimally, the flat comes semi-furnished. Studded with almost all the features, the flat is select date for rent. "
hyderabad,3 BHK Apartment for Rent in Kondapur,Fortune Nest,Furnished,Bachelors,Immediately,1850 sqft,3 out of 4,South,Main Road,3,2,"₹45,000","Do you want to rent flat for accomodation? Consider 3 BHK flat in the popular locality of Kondapur. Located within the premium project of Fortune Nest, this well-ventilated flat is available on rent. The rent amount of the flat is very competitive and set at an amount of Rs 45,000/-. You just have to deposit an initial booking amount of Rs 90000/-. We have some preferences about the tenants to rent the flat and the preferred tenants are Bachelors. Some added-on facilities available with the flat are air conditioned,ro water system. It is well placed and enables a view of main road. Also, it features 2 balconies that are spacious. The flat on rent has 3 large and spacious bedrooms. With the flat, you get hold of 1 store room which is spacious and can be used to store unused articles. The flat comes furnished and is sure to appeal to you. The flat is immediately available for rent. "
hyderabad,"3 BHK Apartment for Rent in Kokapet, Outer Ring Road",The Lawnz,Semi-Furnished,Bachelors/Family,Immediately,None,Ground out of 4,None,None,3,1,"₹25,000","Multistorey apartment is available for rent. It is a good location property. Please contact for more details. If you are planning to rent a flat, you can consider this 3 BHK flat situated in the prime location of Kokapet, Outer Ring Road. The spacious flat offered on rent is part of the popular project The Lawnz. The Rent amount is set at an attractive price of Rs 25,000/-. You just have to deposit an initial booking amount of Rs 50000/-. We are selective about renting out the flat and the type of tenants preferred are Bachelors/Family. The flat also has 1 balconies for a multiple usages. The flat listed for rent boasts of 3 sizable and aesthetically designed bedrooms. The flat comes semi-furnished and is sure to appeal to you. Owing to continuous demand, the flat is immediately available for rent. "
hyderabad,"3 BHK Apartment for Rent in Sri Laxmi Nagar Colony-Manikonda, Outer Ring Road",None,Furnished,Family,Immediately,2800 sqft,3 out of 5,North,Main Road,3,2,"₹45,000","North facing, modern amenities in the house like false ceiling lights, modular kitchen, Park etc Looking out for a flat for rent? Rent flats of 3 BHK in the well-connected locality of Sri Laxmi Nagar Colony-Manikonda, Outer Ring Road. Affordable to rent, the flat is available for rent at a competitive amount of Rs 45,000/-. We are particular about whom we let out the flat to and the type of tenants preferred are Family. The flat boasts of a superb location near the property is close to lanco hills, harivillu, mana studio etc.. It is well-positioned and one can get a view of main road. The flat comes with 1 covered car parking for dedicated use. In addition to this, the flat is studded with capacious 2 balconies. The flat listed for rent boasts of 3 sizable and aesthetically designed bedrooms. Also, it has 1 study room that can be used as a guest room or a home office. To serve the occupier optimally, the flat comes furnished. Studded with almost all the features, the flat is immediately available for rent. "
hyderabad,"2 BHK Apartment for Rent in Beeramguda, Ramachandra Puram, NH 9",Parshavedi Meadows,Unfurnished,Bachelors/Family,Immediately,900 sqft,2 out of 4,None,None,2,2,"₹7,500","Multistorey apartment is available for sale. It is a good location property. Please contact for more details. If you are planning to rent a flat, you can consider this 2 BHK flat situated in the prime location of Beeramguda, Ramachandra Puram, NH 9. The state-of-the art flat available on rent is part of the Parshavedi Meadows. The rental amount of the flat is an affordable Rs 7,500/-. Although, the occupier is required to deposit a booking amount of Rs 20000/-. We are selective about renting out the flat and the type of tenants preferred are Bachelors/Family. Also, there are 2 balconies in the flat. The flat listed for rent boasts of 2 sizable and aesthetically designed bedrooms. To serve the occupier optimally, the flat comes unfurnished. It is immediately available for rent. "
hyderabad,"2 BHK Apartment for Rent in Ramgopalpet, NH 7",None,Semi-Furnished,Bachelors/Family,Immediately,None,4 out of 4,None,None,2,None,"₹15,000","If taking a flat for rent is on you mind, you must go for 2 BHK flat in Ramgopalpet, NH 7 located at the heart of the city. Affordable to rent, the flat is available for rent at a competitive amount of Rs 15,000/-. We are particular about whom we let out the flat to and the type of tenants preferred are Bachelors/Family. The flat on rent has 2 large and spacious bedrooms. A beautifully designed abode, the flat is semi-furnished. It is immediately available for rent. "
hyderabad,"3 BHK Apartment for Rent in Mallareddy Nagar, Secunderabad",None,Furnished,Bachelors,Immediately,1260 sqft,2 out of 5,East,Main Road,3,2,"₹20,000","Looking out for a flat for rent? Rent flats of 3 BHK in the well-connected locality of Mallareddy Nagar, Secunderabad. The rental amount of the flat is an affordable Rs 20,000/-. However, you will have to deposit a booking amount of Rs 40000/- if you wish to rent this flat. We are selective about renting out the flat and the type of tenants preferred are Bachelors. It is well-positioned and one can get a view of main road. Also, it features 2 balconies that are spacious. The flat available on rent features 3 spacious bedrooms. A beautifully designed abode, the flat is furnished. Owing to continuous demand, the flat is immediately available for rent. "
hyderabad,3 BHK Apartment for Rent in Kothaguda,Patels Wisdom,Semi-Furnished,Family,Immediately,1750 sqft,2 out of 5,East,Main Road,3,2,"₹24,000","A spacious 3 BHK flat is a private commuity close to main road , nearby to schools, grocery store in prime are close to hitech city main road. If you are planning to rent a flat, you can consider this 3 BHK flat situated in the prime location of Kothaguda. Located within the premium project of Patels Wisdom, this well-ventilated flat is available on rent. Affordable to rent, the flat is available for rent at a competitive amount of Rs 24,000/-. You just have to deposit an initial booking amount of Rs 48000/-. We have some choices in term of preferred tenants to let out the flat and the tenants preferred are Family. Some added-on facilities available with the flat are air conditioned,laundry service,ro water system,service/goods lift,visitor parking. Strategically located near google office, the flat is smartly located to offer seamless connectivity. It is well placed and enables a view of main road. To park your car, the flat comes with a its own 1 covered car parking. Also, it features 2 balconies that are spacious. This flat on rent comes with 3 well planned bedrooms. With 1 store room attached, the extra articles can be easily stored. Designed to meet your modern needs, the flat comes semi-furnished. Owing to continuous demand, the flat is immediately available for rent. "
hyderabad,3 BHK Apartment for Rent in Hyderabad,None,Semi-Furnished,Bachelors/Family,Immediately,None,4 out of 5,West,None,2,2,"₹16,000","The 3 bedroom Unit is located on fourth floor and it has spacious 2 bathroom You can get this beautiful flat on a rental of 16000 monthly. Affordable to rent, the flat is available for rent at a competitive amount of Rs 16,000/-. We have some preferences about the tenants to rent the flat and the preferred tenants are Bachelors/Family. The flat is strategically located near 4th lane on left hand from maheshwari gas agency o u colony :::::::: from maheshwari gas agency. The flat has 5 covered, 4 open car parking for your convenience. It also has 2 balconies. The flat available on rent features 3 spacious bedrooms. The flat is well-designed and comes semi-furnished, with a unique appeal. It is immediately available for rent. "
hyderabad,"3 BHK Apartment for Rent in Financial District, Nanakram Guda",My Home Krishe,Semi-Furnished,Bachelors/Family,Immediately,2580 sqft,9 out of 28,West,None,3,3,"₹72,000","InKrishetheinteriorsarethoughtfullydesignedtoprovideadequatespacelightandventilationtotheresidentialunitsGachibowliiswell-connectedtootherpartsofthecityviaanextensiveroad Rent flats of 3 BHK in the prime locality of Financial District, Nanakram Guda. Located within the premium project of My Home Krishe, this well-ventilated flat is available on rent. The rental rates are quite justifiable and set at an amount of Rs 72,000/-. However, you are required to deposit a booking amount of Rs 300000/-. We keep a say in the type of tenants preferred to rent our flat and the tenants preferred are Bachelors/Family. Some attractive additional facilities available with the flat are jogging and strolling track. Strategically located near my home constructions presents a housing project located in gachibowli, hyderabad. the project comes equipped with all the basic facilities necessary to meet daily requirements of the modern urban lifestyle of its residents, including tennis court, landscaped gardens, others, internal roads, amphitheater., the flat is smartly located to offer seamless connectivity. The flat is bundled with spacious 2 covered car parking. It also has 3 balconies. The flat listed for rent boasts of 3 sizable and aesthetically designed bedrooms. Designed to meet your modern needs, the flat comes semi-furnished. It is immediately available for rent. "
hyderabad,"2 BHK Apartment for Rent in Himayath Nagar, NH 7",None,Semi-Furnished,Bachelors/Family,Immediately,1250 sqft,4 out of 5,East,Main Road,2,2,"₹22,000","2bhk , himayath nagar near liberty, for rent. Rent flats of 2 BHK in the prime locality of Himayath Nagar, NH 7. The Rent amount is set at an attractive price of Rs 22,000/-. Although, the occupier is required to deposit a booking amount of Rs 66000/-. We are particular about whom we let out the flat to and the type of tenants preferred are Bachelors/Family. The flat is strategically located near near liberty, himayath nagar.. It provides an amazing view of main road. The flat is bundled with spacious 1 covered car parking. Also, it features 2 balconies that are spacious. This flat on rent comes with 2 well planned bedrooms. The flat comes semi-furnished and is sure to appeal to you. Owing to continuous demand, the flat is immediately available for rent. "
hyderabad,"2 BHK Apartment for Rent in LB Nagar, NH 9",Sahara States,Unfurnished,Bachelors/Family,Immediately,900 sqft,2 out of 2,None,None,2,1,"₹10,000","Rent flats of 2 BHK in the prime locality of LB Nagar, NH 9. The spacious flat offered on rent is part of the popular project Sahara States. The rent amount of the flat is very competitive and set at an amount of Rs 10,000/-. Although, the occupier is required to deposit a booking amount of Rs 20000/-. We are selective about renting out the flat and the type of tenants preferred are Bachelors/Family. The flat comes with some add-on facilities such as jogging and strolling track. In addition to this, the flat is studded with capacious 1 balconies. The flat offered on rent is equipped with 2 well-designed bedrooms. With the flat, you get hold of 1 store room which is spacious and can be used to store unused articles. The flat is well-designed and comes unfurnished, with a unique appeal. It is immediately available for rent. "
hyderabad,"3 BHK Apartment for Rent in Himayath Nagar, NH 7",None,Semi-Furnished,Bachelors/Family,From Jun '22,None,2 out of 5,None,None,2,None,"₹35,000","If taking a flat for rent is on you mind, you must go for 3 BHK flat in Himayath Nagar, NH 7 located at the heart of the city. Affordable to rent, the flat is available for rent at a competitive amount of Rs 35,000/-. We are particular about whom we let out the flat to and the type of tenants preferred are Bachelors/Family. The flat on rent has 3 large and spacious bedrooms. To serve the occupier optimally, the flat comes semi-furnished. The flat is select date for rent. "
hyderabad,3 BHK Apartment for Rent in ROHIT APARTMENT VIDYANAGAR,None,Semi-Furnished,Bachelors/Family,Immediately,1500 sqft,5 out of 5,None,None,2,3,"₹19,000","The rental rates are quite justifiable and set at an amount of Rs 19,000/-. Plus you need to pay a booking amount of only Rs 38000/-. We have some preferences about the tenants to rent the flat and the preferred tenants are Bachelors/Family. Also, there are 3 balconies in the flat. The flat available on rent features 3 spacious bedrooms. Designed to meet your modern needs, the flat comes semi-furnished. Studded with almost all the features, the flat is immediately available for rent. "
hyderabad,"2 BHK Apartment for Rent in Beeramguda, Ramachandra Puram, NH 9",None,Semi-Furnished,Bachelors/Family,Immediately,950 sqft,Ground out of 5,North,Main Road,2,2,"₹9,000","Rent flats of 2 BHK in the prime locality of Beeramguda, Ramachandra Puram, NH 9. The rental rates are quite justifiable and set at an amount of Rs 9,000/-. However, you are required to deposit a booking amount of Rs 12000/-. We keep a say in the type of tenants preferred to rent our flat and the tenants preferred are Bachelors/Family. It is well-positioned and one can get a view of main road. In addition to this, the flat is studded with capacious 2 balconies. The flat listed for rent boasts of 2 sizable and aesthetically designed bedrooms. Designed to meet your modern needs, the flat comes semi-furnished. Studded with almost all the features, the flat is immediately available for rent. "
hyderabad,3 BHK Apartment for Rent in Nizampet,None,Furnished,Bachelors/Family,From Jun '22,None,2 out of 4,East,None,2,2,"₹16,000","Multistorey apartment is available for rent, 3 BHK apartment with complete woodwork, pop ceiling and DG backup. Please contact for more details. Rent flats of 3 BHK in the prime locality of Nizampet. The rent amount of the flat is very competitive and set at an amount of Rs 16,000/-. We are particular about whom we let out the flat to and the type of tenants preferred are Bachelors/Family. The flat boasts of a superb location near sbi bank and nizampet town bus stand.. To park your car, the flat comes with a its own 1 covered car parking. In addition to this, the flat is studded with capacious 2 balconies. The flat listed for rent boasts of 3 sizable and aesthetically designed bedrooms. The flat comes furnished and is sure to appeal to you. It is jun '22 for rent. "
hyderabad,"2 BHK Apartment for Rent in Rajendra Nagar, Outer Ring Road",Provident Kenworth,Furnished,Bachelors/Family,Immediately,930 sqft,7 out of 10,None,None,2,1,"₹22,000","Looking out for a flat for rent? Rent flats of 2 BHK in the well-connected locality of Rajendra Nagar, Outer Ring Road. This charming flat available on rent is part of the Provident Kenworth. Affordable to rent, the flat is available for rent at a competitive amount of Rs 22,000/-. However, you will have to deposit a booking amount of Rs 44000/- if you wish to rent this flat. We have some choices in term of preferred tenants to let out the flat and the tenants preferred are Bachelors/Family. Also, there are 1 balconies in the flat. The flat offered on rent is equipped with 2 well-designed bedrooms. The flat comes furnished and is sure to appeal to you. It is immediately available for rent. "
