City,Accommodation,Apartment Name,Furnishing,Tenant Preferred,Availability,Carpet Area,Floor,Facing,overlooking,Bathroom,Balcony,Rent,Description
kolkata,"2 BHK Apartment for Rent in Shapoorji Pallonji Housing Complex, Action Area 3, Rajarhat Newtown",Shapoorji Pallonji Housing Complex,Furnished,Family,Immediately,None,4 out of 14,None,Garden/Park,2,None,"₹14,000"," This well designed 2 Bedroom Flat is on 4th floor and it has furnished 2 bathroom You can get this spacious Flat on a monthly rental of 14000. Rent flats of 2 BHK in the prime locality of Action Area 3, Rajarhat Newtown. This charming flat available on rent is part of the Shapoorji Pallonji Housing Complex. The rental amount of the flat is an affordable Rs 14,000/-. We have some preferences about the tenants to rent the flat and the preferred tenants are Family. Some premium add-on facilities bundled with the flat are jogging and strolling track. The location ensures a splendid view of garden/park. Ensuring that you park the car safely, the flat has 213 open car parking. The flat listed for rent boasts of 2 sizable and aesthetically designed bedrooms. A beautifully designed abode, the flat is furnished. The flat is immediately available for rent. "
kolkata,"2 BHK Apartment for Rent in Bosepukur, Bosepukur, Kasba",Bosepukur,Unfurnished,Bachelors/Family,From Jul '22,None,1 out of 2,South -West,Main Road,1,1,"₹13,500","2bhk brand new flat in 1st floor,flat handover after 1month,2rooms ,1drawing,1varandah,1bathroom,bike parking available,flat near by acropolis ball900mtr bosepukur sitala mandir bus stand750mtrgarden school500mtrruby hospital 1. 2km,its situated in a very posh area. Most preferable any students,corporate employee, monthly rent 13500 ,advance 2months rent,11month agreement,::::::::brokers pls dont call"
kolkata,"2 BHK Apartment for Rent in Tata Eden Court, New Town",Tata Eden Court,Unfurnished,Bachelors,Immediately,700 sqft,10 out of 20,North - East,"Garden/Park, Pool, Main Road",2,1,"₹20,000","semi furnished 2bhk 2bath flat for rent available for more details please contact. Do you want to rent flat for accomodation? Consider 2 BHK flat in the popular locality of New Town. The aesthetically designed flat available on rent is part of the leading project of Tata Eden Court. The Rent amount is set at an attractive price of Rs 20,000/-. Plus you need to pay a booking amount of only Rs 46000/-. We keep a say in the type of tenants preferred to rent our flat and the tenants preferred are Bachelors. The flat comes with some add-on facilities such as bar/lounge, air conditioned, banquet hall, jogging and strolling track, outdoor tennis courts. The location ensures a splendid view of garden/park, pool, main road. The flat also has 1 balconies for a multiple usages. The flat listed for rent boasts of 2 sizable and aesthetically designed bedrooms. With the flat, you get hold of 1 store room which is spacious and can be used to store unused articles. The flat comes unfurnished and is sure to appeal to you. It is immediately available for rent. "
kolkata,3 BHK Apartment for Rent in Vip Road,None,Unfurnished,Bachelors/Family,Immediately,None,5 out of 5,None,None,2,1,"₹10,000","3 BHK, multistorey apartment is well located available for rent with 1 balcony road facing and garage facility available. If you are planning to rent a flat, you can consider this 3 BHK flat situated in the prime location of Vip Road. The rental rates are quite justifiable and set at an amount of Rs 10,000/-. We keep a say in the type of tenants preferred to rent our flat and the tenants preferred are Bachelors/Family. Also, it features 1 balconies that are spacious. The flat offered on rent is equipped with 3 well-designed bedrooms. To serve the occupier optimally, the flat comes unfurnished. The flat is immediately available for rent. "
kolkata,3 BHK Apartment for Rent in Rabindra Sarovar Metro,None,Unfurnished,Bachelors/Family,Immediately,1200 sqft,2 out of 4,None,Main Road,2,2,"₹30,000","Absolutely new flat for rent. Everything very closeby. 3 mins walking distance from rabindra sarovar metro, tollygunge railway station. Market , hospital and busstops are very closeby. Rent flats of 3 BHK in the prime locality of Rabindra Sarovar Metro. Affordable to rent, the flat is available for rent at a competitive amount of Rs 30,000/-. Although, the occupier is required to deposit a booking amount of Rs 100000/-. We are selective about renting out the flat and the type of tenants preferred are Bachelors/Family. It is well placed and enables a view of main road. It also has 2 balconies. The flat on rent has 3 large and spacious bedrooms. The flat comes unfurnished and is sure to appeal to you. The flat is immediately available for rent. "
kolkata,2 BHK Apartment for Rent in Sodepur,None,Unfurnished,Bachelors/Family,Immediately,870 sqft,4 out of 4,None,None,2,1,"₹8,000","Multistorey apartment is available for rent. It is a good location property. Please contact for more details. If taking a flat for rent is on you mind, you must go for 2 BHK flat in Sodepur located at the heart of the city. The rent amount of the flat is very competitive and set at an amount of Rs 8,000/-. Plus you need to pay a booking amount of only Rs 20000/-. We keep a say in the type of tenants preferred to rent our flat and the tenants preferred are Bachelors/Family. In addition to this, the flat is studded with capacious 1 balconies. The flat offered on rent is equipped with 2 well-designed bedrooms. A beautifully designed abode, the flat is unfurnished. It is immediately available for rent. "
kolkata,2 BHK Apartment for Rent in Nayabad,None,Furnished,Bachelors/Family,Immediately,938 sqft,5 out of 5,South,Main Road,2,1,"₹25,000","Positive and super airy flat. new Garia metro station within 500 meters . 9 multi speciality hospital in a radius of half a km .spencers supermarket and metro cash and carry walking distance. If you are planning to rent a flat, you can consider this 2 BHK flat situated in the prime location of Nayabad. Affordable to rent, the flat is available for rent at a competitive amount of Rs 25,000/-. We are particular about whom we let out the flat to and the type of tenants preferred are Bachelors/Family. The flat comes with some add-on facilities such as visitor parking. The flat boasts of a superb location near upohar ambuja. It provides an amazing view of main road. The flat also has 1 balconies for a multiple usages. The flat on rent has 2 large and spacious bedrooms. A beautifully designed abode, the flat is furnished. It is immediately available for rent. "
kolkata,"1 BHK Apartment for Rent in Ballygunge Place, Ballygunge",None,Furnished,Bachelors/Family,Immediately,550 sqft,1 out of 4,South - East,Main Road,1,None,"₹20,000"," This Apartment has 1 bedroom and it lies on 1 floor and it has spacious 1 bathroom Get this Apartment on a monthly charges of 20000. If you are planning to rent a flat, you can consider this 1 BHK flat situated in the prime location of Ballygunge Place, Ballygunge. The rental rates are quite justifiable and set at an amount of Rs 20,000/-. You just have to deposit an initial booking amount of Rs 40000/-. We have some choices in term of preferred tenants to let out the flat and the tenants preferred are Bachelors/Family. Some premium add-on facilities bundled with the flat are air conditioned,ro water system. It is well-positioned and one can get a view of main road. The flat offered on rent is equipped with 1 well-designed bedrooms. In addition to this, 1 study room can be doubled up as a small office or guest area. The flat is well-designed and comes furnished, with a unique appeal. It is immediately available for rent. "
noida,2 BHK Apartment for Rent in Noida Extension,Divyansh Flora,Unfurnished,Bachelors/Family,Immediately,800 sqft,12 out of 18,North - East,"Garden/Park, Pool",2,3,"₹11,000","2bhk Flat avaliable for rent having all the things near by Like mall market school etc Do you want to rent flat for accomodation? Consider 2 BHK flat in the popular locality of Noida Extension. The spacious flat offered on rent is part of the popular project Divyansh Flora. The rent amount of the flat is very competitive and set at an amount of Rs 11,000/-. We are selective about renting out the flat and the type of tenants preferred are Bachelors/Family. Strategically located near well connected with roads and near by market as well, the flat is smartly located to offer seamless connectivity. Also, it overlooks garden/park, pool to offer a soothing view. Also, it features 3 balconies that are spacious. The flat on rent has 2 large and spacious bedrooms. Designed to meet your modern needs, the flat comes unfurnished. It is immediately available for rent. "
noida,4 BHK Apartment for Rent in Noida Extension,11th Avenue Gaur City 2,Unfurnished,Bachelors,Immediately,None,14 out of 20,North - East,Garden/Park,3,4,"₹16,900","Rent flats of 4 BHK in the prime locality of Noida Extension. The spacious flat offered on rent is part of the popular project 11th Avenue Gaur City 2. The rental rates are quite justifiable and set at an amount of Rs 16,900/-. However, you are required to deposit a booking amount of Rs 17000/-. We have some choices in term of preferred tenants to let out the flat and the tenants preferred are Bachelors. Some added-on facilities available with the flat are bar/lounge, banquet hall, jogging and strolling track, outdoor tennis courts, laundry service. It is well placed and enables a view of garden/park. It also has 4 balconies. The flat available on rent features 4 spacious bedrooms. Designed to meet your modern needs, the flat comes unfurnished. The flat is immediately available for rent. "
noida,2 BHK Apartment for Rent in Sector 74,Ajnara Grand Heritage,Semi-Furnished,Family,From Jun '22,990 sqft,2 out of 19,South,"Garden/Park, Main Road",2,3,"₹17,000","2stdflatavailableforrentinsec74noidaitislocatedinwhichisaverygoodsociety If taking a flat for rent is on you mind, you must go for 2 BHK flat in Sector 74 located at the heart of the city. The state-of-the art flat available on rent is part of the Ajnara Grand Heritage. The Rent amount is set at an attractive price of Rs 17,000/-. However, you are required to deposit a booking amount of Rs 20000/-. We keep a say in the type of tenants preferred to rent our flat and the tenants preferred are Family. Some premium add-on facilities bundled with the flat are jogging and strolling track. The flat is strategically located near 2+std flat available for rent in sec 74 noida . it is located in which is a very good society. It is well placed and enables a view of garden/park, main road. The flat comes with 1 covered car parking for dedicated use. Also, it features 3 balconies that are spacious. The flat listed for rent boasts of 2 sizable and aesthetically designed bedrooms. Also, it has 1 study room that can be used as a guest room or a home office. The flat comes semi-furnished and is sure to appeal to you. Studded with almost all the features, the flat is select date for rent. "
noida,"2 BHK Apartment for Rent in Sector 150, Pusta Road",ACE Golfshire,Semi-Furnished,Bachelors/Family,Immediately,925 sqft,16 out of 25,None,Main Road,2,3,"₹20,000","the unit is semi furnished with modular kitchen and wadrobes in both rooms. Looking out for a flat for rent? Rent flats of 2 BHK in the well-connected locality of Sector 150, Pusta Road. The spacious flat offered on rent is part of the popular project Ace Golfshire. Affordable to rent, the flat is available for rent at a competitive amount of Rs 20,000/-. We have some preferences about the tenants to rent the flat and the preferred tenants are Bachelors/Family. The flat is well-connected and positioned near the property is close to metro station and market nearby.. It provides an amazing view of main road. The flat is bundled with spacious 1 covered car parking. Also, it features 3 balconies that are spacious. The flat on rent has 2 large and spacious bedrooms. The flat is well-designed and comes semi-furnished, with a unique appeal. Owing to continuous demand, the flat is immediately available for rent. "
noida,3 BHK Apartment for Rent in Sector 74,Supertech Capetown,Semi-Furnished,Bachelors/Family,Immediately,1458 sqft,9 out of 24,South - East,Main Road,3,3,"₹22,000","ready to move flat on rent .good looking. near by market. Looking out for a flat for rent? Rent flats of 3 BHK in the well-connected locality of Sector 74. The aesthetically designed flat available on rent is part of the leading project of Supertech Capetown. The rental amount of the flat is an affordable Rs 22,000/-. You just have to deposit an initial booking amount of Rs 28000/-. We have some preferences about the tenants to rent the flat and the preferred tenants are Bachelors/Family. Some attractive additional facilities available with the flat are jogging and strolling track. The flat is centrally located near near by metro station and maeket. near by north eye.. It provides an amazing view of main road. The flat has 1 covered car parking for your convenience. It also has 3 balconies. The flat offered on rent is equipped with 3 well-designed bedrooms. Designed to meet your modern needs, the flat comes semi-furnished. It is immediately available for rent. "
noida,"3 BHK Apartment for Rent in Sector 134, Noida Express Way",Jaypee Kosmos,Semi-Furnished,Bachelors,Immediately,1050 sqft,7 out of 16,None,Garden/Park,2,2,"₹13,000","this 3 bhk flat is available for rent having all ameneties for more details call us Rent flats of 3 BHK in the prime locality of Sector 134, Noida Express Way. Located within the premium project of Jaypee Kosmos, this well-ventilated flat is available on rent. The rental rates are quite justifiable and set at an amount of Rs 13,000/-. Although, the occupier is required to deposit a booking amount of Rs 26000/-. We have some preferences about the tenants to rent the flat and the preferred tenants are Bachelors. The flat is well-connected and positioned near near axis house. Also, it overlooks garden/park to offer a soothing view. The flat has 1 covered car parking for your convenience. The flat also has 2 balconies for a multiple usages. The flat listed for rent boasts of 3 sizable and aesthetically designed bedrooms. Designed to meet your modern needs, the flat comes semi-furnished. Studded with almost all the features, the flat is immediately available for rent. "
noida,"1 BHK Apartment for Rent in Sector 119, Pusta Road",Eldeco Aamantran,Furnished,Bachelors/Family,Immediately,400 sqft,8 out of 15,North,"Garden/Park, Main Road",1,1,"₹16,000","Eldeco Edge offers facilities such as Lift and Gymnasium.::::It also has amenities like Swimming pool, Golf course, Jogging track and Lawn tennis court.::::The project has indoor activities such as Squash court.::::It also offers services like Banquet hall, Community hall and Grocery shop."
noida,3 BHK Apartment for Rent in Noida Extension Block A,Mahagun Mywoods,Semi-Furnished,Bachelors/Family,Immediately,1290 sqft,10 out of 21,North - East,Garden/Park,3,4,"₹12,000","Commercial Hub Sector 18 market is just 7 km::::Proposed Metro Station in immediate neighborhood.::::7 K.M. from Atta Market. Looking out for a flat for rent? Rent flats of 3 BHK in the well-connected locality of Noida Extension Block A. The state-of-the art flat available on rent is part of the Mahagun Mywoods. The rental amount of the flat is an affordable Rs 12,000/-. Plus you need to pay a booking amount of only Rs 30001/-. We have some preferences about the tenants to rent the flat and the preferred tenants are Bachelors/Family. Some attractive additional facilities available with the flat are jogging and strolling track. The flat is centrally located near proposed metro station in immediate neighborhood. It provides an amazing view of garden/park. The flat is bundled with spacious 1 covered car parking. The flat also has 4 balconies for a multiple usages. The flat offered on rent is equipped with 3 well-designed bedrooms. A beautifully designed abode, the flat is semi-furnished. Owing to continuous demand, the flat is immediately available for rent. "
noida,"3 BHK Apartment for Rent in Sultanpur, Sector 128, Noida Express Way",Imperial Court,Semi-Furnished,Family,Immediately,1985 sqft,5 out of 13,North - East,"Garden/Park, Main Road",3,1,"₹42,000","A SEMI FURNISHED 3 BHK FLAT PLUS SERVANT ROOM WITH ATTACHED WASHROOM AVAILABLE ON RENT IN KALYPSO AND IMPERIAL COURT IN JAYPEE GREENS WISHTOWN. ITS A GOLF FACING APARTMENT WITH SUPER AREA OF 2650 SQ FEET APPROX. ::::FLAT IS SEMI FURNISHED WITH WOODEN FLOORING AND WOODEN WARDROBES IN EACH BEDROOMS , MODULAR KITCHEN AND 5 SPLIT ACs."
noida,"2 BHK Apartment for Rent in Sector 137, Noida Express Way",Paras Tierea,Semi-Furnished,Family,Immediately,None,5 out of 18,East,None,2,2,"₹15,000","Your search for a spacious home at affordable rent in Noida ends here. ::::The 2 BHK property offers a serene environment with excellent views of the city. ::::This Apartment is equipped with the latest lifestyle amenities and all the conveniences at the doorstep. ::::It is an unfurnished Apartment. This unit is built on floor 4 out of a total 19 floors. ::::The Apartment has been thoughtfully designed to meet a family’s space needs, with 2 bedrooms. ::::It includes 2 bathroom. There are 0 balcony that lets you enjoy scenic views. ::::The builtup area of this Apartment is 1070 Square feet."
noida,"3 BHK Apartment for Rent in Sector 93A, Noida Express Way",ATS Green Village,Furnished,Bachelors,Immediately,1500 sqft,8 out of 18,East,"Pool, Garden/Park, Main Road",3,3,"₹70,000","Looking out for a flat for rent? Rent flats of 3 BHK in the well-connected locality of Sector 93A, Noida Express Way. Located within the premium project of Ats Green Village, this well-ventilated flat is available on rent. The rent amount of the flat is very competitive and set at an amount of Rs 70,000/-. Plus you need to pay a booking amount of only Rs 140000/-. We have some preferences about the tenants to rent the flat and the preferred tenants are Bachelors. Some attractive additional facilities available with the flat are air conditioned, outdoor tennis courts, internet/wi-fi connectivity, ro water system, intercom facility. It provides an amazing view of pool, garden/park, main road. In addition to this, the flat is studded with capacious 3 balconies. The flat listed for rent boasts of 3 sizable and aesthetically designed bedrooms. Moreover, 1 study room can be utilised as a guest room or office area. To serve the occupier optimally, the flat comes furnished. It is immediately available for rent. "
noida,"3 BHK Apartment for Rent in Sector 107, Dadri Road",None,Semi-Furnished,Bachelors/Family,Immediately,None,4 out of 18,None,None,3,None,"₹30,000"," It's a 4th floor Multistorey Apartment in a building of total 18 floors. Separate servant quarter is present in the house. The Multistorey Apartment is newly constructed. The location has easy access to, Sahmal Nursing Home (1 km ), Bank of India (2 km ), Maharishi Ved Vigyan University (2 km ) and Noida City Centre (4 km ). "
noida,"3 BHK Apartment for Rent in Sector 143, Noida Express Way",Gulshan Ikebana,Semi-Furnished,Family,Immediately,None,19 out of 19,North - East,Main Road,2,4,"₹20,000","A 3BHK Flat with 1495 Sq. ft. area. The Flat is semifurnished with good quality woodwork that includes designer wardrobes in all the three bedrooms, Modular kitchen with chimney, Covered Utility Area, three Balconies, two bathrooms, well ventilated with one Covered Parking. The society is well maintained, has landscaped parks and round the clock security, gym, badminton court, happening Ikebana street, pool, yoga centre, snooker etc apart from other amenities."
noida,3 BHK Apartment for Rent in Noida Extension Block B,Hawelia Valenova Park,Semi-Furnished,Family,Immediately,1670 sqft,10 out of 19,East,None,2,5,"₹16,500","French Apartments - G.Noida (W) Noida Extn.:::: :::: ::::::ANTHEM INFRASTRUCTURE PVT. LTD has launched its new project French Apartments in Noida. French Apartments is located in the best area of Noida Extension, where all the luxurious facilities of quality education, health and Markets are available. Anthem Group has been developing commercial buildings in all major cities of the nation.::::::::French Apartments are equipped with all attracting features like two side open corner plot, fire fighting instruments on all floors, earthquake resistant structure (designed by highly experienced structural engineers), 24 hours water supply, and separate R.O system in each kitchen."
noida,"3 BHK Apartment for Rent in Sector 150, Pusta Road",ACE Golfshire,Furnished,Family,Immediately,1675 sqft,4 out of 23,North - East,Garden/Park,3,3,"₹38,000","A 3bhk fully furnished apartment is available on rent in the most preferable luxurious society i.e., ACE GOLFSHIRE Noida 150. This apartment consists to every single thing we need in an apartment, totally ready to move in at its very best rent. Finalize it now and start living a luxury life in such a luxurious apartment. We have number of options available in this society and other , with different kinds of furnishing. In case you requirement differs , straightaway contact us and get your family a shelter that fulfills all your requirements.::::::::::::Regards::::Chhabra Properties"
noida,"3 BHK Apartment for Rent in Sector 137, Noida Express Way",Paras Tierea,Semi-Furnished,Bachelors/Family,Immediately,None,11 out of 25,East,None,3,3,"₹18,500","East facing flat with modular kitchen Looking out for a flat for rent? Rent flats of 3 BHK in the well-connected locality of Sector 137, Noida Express Way. The aesthetically designed flat available on rent is part of the leading project of Paras Tierea. The rental rates are quite justifiable and set at an amount of Rs 18,500/-. However, you will have to deposit a booking amount of Rs 18500/- if you wish to rent this flat. We keep a say in the type of tenants preferred to rent our flat and the tenants preferred are Bachelors/Family. Some attractive additional facilities available with the flat are jogging and strolling track. The flat is bundled with spacious 1 covered car parking. In addition to this, the flat is studded with capacious 3 balconies. This flat on rent comes with 3 well planned bedrooms. The flat comes semi-furnished and is sure to appeal to you. The flat is immediately available for rent. "
noida,"3 BHK Apartment for Rent in Sector 137, Noida Express Way",Paramount Floraville,Semi-Furnished,Bachelors/Family,Immediately,1300 sqft,None,North - East,Main Road,2,5,"₹21,000","paramount floraville is available for rent. this is 3 BHK semifurnished flat. this is new flat. Looking out for a flat for rent? Rent flats of 3 BHK in the well-connected locality of Sector 137, Noida Express Way. This charming flat available on rent is part of the Paramount Floraville. The Rent amount is set at an attractive price of Rs 21,000/-. Although, the occupier is required to deposit a booking amount of Rs 19000/-. We keep a say in the type of tenants preferred to rent our flat and the tenants preferred are Bachelors/Family. Some attractive additional facilities available with the flat are banquet hall, jogging and strolling track, outdoor tennis courts, internet/wi-fi connectivity, service/goods lift. The flat is well-connected and positioned near sector 137 metro station.. It provides an amazing view of main road. To park your car, the flat comes with a its own 1 covered car parking. In addition to this, the flat is studded with capacious 5 balconies. This flat on rent comes with 3 well planned bedrooms. Designed to meet your modern needs, the flat comes semi-furnished. It is immediately available for rent. "
noida,2 BHK Apartment for Rent in Sector 100,Lotus Boulevard,Semi-Furnished,Bachelors,Immediately,790 sqft,11 out of 26,South - East,Garden/Park,2,2,"₹20,000","yes If taking a flat for rent is on you mind, you must go for 2 BHK flat in Sector 100 located at the heart of the city. The state-of-the art flat available on rent is part of the Lotus Boulevard. The Rent amount is set at an attractive price of Rs 20,000/-. However, you are required to deposit a booking amount of Rs 40000/-. We are selective about renting out the flat and the type of tenants preferred are Bachelors. If you rent the flat, you will have access to facilities like bar/lounge, air conditioned, banquet hall, jogging and strolling track, outdoor tennis courts. Strategically located near starling mall, the flat is smartly located to offer seamless connectivity. The location ensures a splendid view of garden/park. It also has 2 balconies. This flat on rent comes with 2 well planned bedrooms. With 1 store room attached, the extra articles can be easily stored. The flat is well-designed and comes semi-furnished, with a unique appeal. Owing to continuous demand, the flat is immediately available for rent. "
noida,3 BHK Builder Floor for Rent in Sector 19 Pocket A,None,Unfurnished,Bachelors/Family,Immediately,None,1 out of 2,North - West,None,2,2,"₹25,000","Builder floor apartment 3 bedroom set in an independent house on 1st floor. Modular kitchen with gas pipeline and marble flooring. Ideally located with all the facilities like Metro, Malls, School, Hospital, Market at a walking distance. Please contact for more details."
